{
  "$schema": "https://find-nuclei.github.io/schemas/phenotype/v1.json",
  "version": 1,
  "kind": "classification",
  "generatedAt": "2026-04-23T06:57:57.813313+00:00",
  "compartment": "cells",
  "producer": {
    "tool": "find-nuclei-analysis",
    "module": "phenotyping"
  },
  "data": {
    "path": "phenotype_scores.parquet",
    "fk": "object_id",
    "joinTo": "measurements.parquet"
  },
  "classifier": {
    "type": "logistic",
    "cv_folds": 5
  },
  "metrics": {
    "accuracy": 0.9481902058197303,
    "roc_auc": 0.9860869766862717,
    "f1": 0.9496204278812974,
    "confusion_matrix": [
      [
        1296,
        73
      ],
      [
        73,
        1376
      ]
    ]
  },
  "training": {
    "n_positive": 1449,
    "n_negative": 1369,
    "label_source": "wells_parquet",
    "positive_wells": [
      "A12",
      "B12",
      "C12",
      "D12",
      "E01",
      "F01",
      "G01",
      "H01"
    ],
    "negative_wells": [
      "A01",
      "B01",
      "C01",
      "D01",
      "E12",
      "F12",
      "G12",
      "H12"
    ],
    "qc_excluded": 189
  },
  "scoring": {
    "n_scored": 15142,
    "n_predicted_positive": 6679,
    "n_predicted_negative": 8463,
    "n_excluded_by_qc": 189,
    "positive_threshold": 0.5
  },
  "features": [
    {
      "name": "ch1_std",
      "coefficient": 5.829559991789817,
      "importance": 5.829559991789817
    },
    {
      "name": "ch1_sum",
      "coefficient": -3.741955097623727,
      "importance": 3.741955097623727
    },
    {
      "name": "perimeter",
      "coefficient": -2.3232388530546206,
      "importance": 2.3232388530546206
    },
    {
      "name": "ch0_sum",
      "coefficient": 1.9936239435732706,
      "importance": 1.9936239435732706
    },
    {
      "name": "ch1_max",
      "coefficient": -1.9587882890573443,
      "importance": 1.9587882890573443
    },
    {
      "name": "ch1_min",
      "coefficient": -1.8477446619952054,
      "importance": 1.8477446619952054
    },
    {
      "name": "ch1_p25",
      "coefficient": 1.5926188398891374,
      "importance": 1.5926188398891374
    },
    {
      "name": "ch0_std",
      "coefficient": -1.1876976051437258,
      "importance": 1.1876976051437258
    },
    {
      "name": "ch0_p25",
      "coefficient": 0.9572941490406247,
      "importance": 0.9572941490406247
    },
    {
      "name": "ch1_median",
      "coefficient": 0.9353088538064362,
      "importance": 0.9353088538064362
    },
    {
      "name": "centroid_x",
      "coefficient": 0.7928896805469902,
      "importance": 0.7928896805469902
    },
    {
      "name": "ch1_p75",
      "coefficient": -0.6172629655074264,
      "importance": 0.6172629655074264
    },
    {
      "name": "ch1_mean",
      "coefficient": 0.6056765799194663,
      "importance": 0.6056765799194663
    },
    {
      "name": "bbox_min_col",
      "coefficient": -0.5360162545079366,
      "importance": 0.5360162545079366
    },
    {
      "name": "area_px",
      "coefficient": 0.3480053394263273,
      "importance": 0.3480053394263273
    },
    {
      "name": "area_um2",
      "coefficient": 0.3480053394263273,
      "importance": 0.3480053394263273
    },
    {
      "name": "bbox_min_row",
      "coefficient": 0.3414381576797567,
      "importance": 0.3414381576797567
    },
    {
      "name": "bbox_max_col",
      "coefficient": -0.3236065020409622,
      "importance": 0.3236065020409622
    },
    {
      "name": "centroid_y",
      "coefficient": -0.2931635975294127,
      "importance": 0.2931635975294127
    },
    {
      "name": "ch0_median",
      "coefficient": -0.28857469836539845,
      "importance": 0.28857469836539845
    },
    {
      "name": "ch0_max",
      "coefficient": -0.23159383216865093,
      "importance": 0.23159383216865093
    },
    {
      "name": "circularity",
      "coefficient": -0.2221980575893336,
      "importance": 0.2221980575893336
    },
    {
      "name": "ch0_p75",
      "coefficient": 0.18993716200834254,
      "importance": 0.18993716200834254
    },
    {
      "name": "solidity",
      "coefficient": -0.1826264752197986,
      "importance": 0.1826264752197986
    },
    {
      "name": "eccentricity",
      "coefficient": -0.09911644321803213,
      "importance": 0.09911644321803213
    },
    {
      "name": "bbox_max_row",
      "coefficient": 0.04472245115339017,
      "importance": 0.04472245115339017
    },
    {
      "name": "ch0_mean",
      "coefficient": 0.04182105435107796,
      "importance": 0.04182105435107796
    },
    {
      "name": "ch0_min",
      "coefficient": -0.024537901230263184,
      "importance": 0.024537901230263184
    },
    {
      "name": "orientation",
      "coefficient": 0.012292798192944663,
      "importance": 0.012292798192944663
    }
  ],
  "qc_criteria": [
    {
      "column": "area_px",
      "op": "ge",
      "value": 100,
      "flag": "area_px_ge"
    }
  ],
  "plateStats": {
    "controls": {
      "positive_wells": [
        "A12",
        "B12",
        "C12",
        "D12",
        "E01",
        "F01",
        "G01",
        "H01"
      ],
      "negative_wells": [
        "A01",
        "B01",
        "C01",
        "D01",
        "E12",
        "F12",
        "G12",
        "H12"
      ],
      "n_positive_wells": 8,
      "n_negative_wells": 8,
      "n_positive_objects": 1449,
      "n_negative_objects": 1369,
      "positive_mean": 0.9017293821439102,
      "positive_std": 0.05362157483533927,
      "positive_cv": 0.05946526296819905,
      "negative_mean": 0.09090414742476187,
      "negative_std": 0.013570007053291132,
      "negative_cv": 0.14927819508480122,
      "signal_window": 59.75127584937393,
      "sn_ratio": 20.731122534837457,
      "sb_ratio": 9.919562612808614
    },
    "quality": {
      "z_prime": 0.7513955695573384,
      "ssmd": 14.659117325992815,
      "icc_between": 0.726425859111824
    },
    "per_well": [
      {
        "well_id": "A01",
        "n": 252,
        "mean": 0.09119115810578025,
        "std": 0.156257970715593,
        "robust_z": 0.013617310540181208,
        "control_type": "negative",
        "compound": "Wortmannin",
        "dose": 0.0,
        "dose_unit": "nM"
      },
      {
        "well_id": "A02",
        "n": 209,
        "mean": 0.13316484036391574,
        "std": 0.25151638265820253,
        "robust_z": 2.005071648740622,
        "control_type": "empty",
        "compound": "Wortmannin",
        "dose": 0.0,
        "dose_unit": "nM"
      },
      {
        "well_id": "A03",
        "n": 188,
        "mean": 0.1832601654205655,
        "std": 0.30099520604021157,
        "robust_z": 4.381859841734819,
        "control_type": null,
        "compound": "Wortmannin",
        "dose": 0.98,
        "dose_unit": "nM"
      },
      {
        "well_id": "A04",
        "n": 148,
        "mean": 0.08016390783847954,
        "std": 0.20186859343180727,
        "robust_z": -0.5095739893839888,
        "control_type": null,
        "compound": "Wortmannin",
        "dose": 1.95,
        "dose_unit": "nM"
      },
      {
        "well_id": "A05",
        "n": 172,
        "mean": 0.11021107317023618,
        "std": 0.2180686035601139,
        "robust_z": 0.9160230640876476,
        "control_type": null,
        "compound": "Wortmannin",
        "dose": 3.91,
        "dose_unit": "nM"
      },
      {
        "well_id": "A06",
        "n": 184,
        "mean": 0.14907889354739318,
        "std": 0.21040890398962495,
        "robust_z": 2.760118824627746,
        "control_type": null,
        "compound": "Wortmannin",
        "dose": 7.81,
        "dose_unit": "nM"
      },
      {
        "well_id": "A07",
        "n": 151,
        "mean": 0.3503598171567508,
        "std": 0.29694193048053974,
        "robust_z": 12.30995450627453,
        "control_type": null,
        "compound": "Wortmannin",
        "dose": 15.63,
        "dose_unit": "nM"
      },
      {
        "well_id": "A08",
        "n": 167,
        "mean": 0.8383502772381464,
        "std": 0.23425282260502217,
        "robust_z": 35.46281283194989,
        "control_type": null,
        "compound": "Wortmannin",
        "dose": 31.25,
        "dose_unit": "nM"
      },
      {
        "well_id": "A09",
        "n": 164,
        "mean": 0.8824127973430367,
        "std": 0.19239337208558827,
        "robust_z": 37.553372727917086,
        "control_type": null,
        "compound": "Wortmannin",
        "dose": 62.5,
        "dose_unit": "nM"
      },
      {
        "well_id": "A10",
        "n": 134,
        "mean": 0.7418774910122428,
        "std": 0.30196105404474705,
        "robust_z": 30.885631648123162,
        "control_type": null,
        "compound": "Wortmannin",
        "dose": 125.0,
        "dose_unit": "nM"
      },
      {
        "well_id": "A11",
        "n": 145,
        "mean": 0.7214420660548734,
        "std": 0.31049985501369265,
        "robust_z": 29.916066589855372,
        "control_type": null,
        "compound": "Wortmannin",
        "dose": 250.0,
        "dose_unit": "nM"
      },
      {
        "well_id": "A12",
        "n": 170,
        "mean": 0.9135033945140141,
        "std": 0.14183397568714898,
        "robust_z": 39.028475727758966,
        "control_type": "positive",
        "compound": "Wortmannin",
        "dose": 150.0,
        "dose_unit": "nM"
      },
      {
        "well_id": "B01",
        "n": 132,
        "mean": 0.0914418132874184,
        "std": 0.1500528625301286,
        "robust_z": 0.025509723166642292,
        "control_type": "negative",
        "compound": "Wortmannin",
        "dose": 0.0,
        "dose_unit": "nM"
      },
      {
        "well_id": "B02",
        "n": 165,
        "mean": 0.08894525558287415,
        "std": 0.21667067847090182,
        "robust_z": -0.09294022937043203,
        "control_type": "empty",
        "compound": "Wortmannin",
        "dose": 0.0,
        "dose_unit": "nM"
      },
      {
        "well_id": "B03",
        "n": 197,